{
  "$schema": "https://json-schema.org/draft/2020-12/schema",
  "$id": "https://example.invalid/schemas/angular-binding-1.json",
  "title": "Angular binding",
  "description": "Framework-specific binding for angular. The semantic root element is declared once in packages/platform-web/components.json. A WC host tag is derived from component identity, independently of the semantic root.",
  "type": "object",
  "additionalProperties": false,
  "required": ["component", "contract", "framework"],
  "properties": {
    "$schema": {
      "type": "string"
    },
    "component": {
      "type": "string",
      "pattern": "^[A-Z][A-Za-z0-9]*$",
      "description": "Must match the contract's `component`, the directory name, and the exported class."
    },
    "contract": {
      "type": "string",
      "description": "Relative path to the agnostic contract this realises."
    },
    "framework": {
      "const": "angular",
      "description": "Named explicitly so a directory can hold more than one binding without ambiguity."
    },
    "propOverrides": {
      "type": "object",
      "description": "Where a contract axis is exposed under a different input name in Angular, because the framework already owns the canonical one. Keyed by axis name.",
      "propertyNames": {
        "pattern": "^[a-z][a-zA-Z0-9]*$"
      },
      "additionalProperties": {
        "type": "object",
        "additionalProperties": false,
        "required": ["prop", "reason"],
        "properties": {
          "prop": {
            "type": "string"
          },
          "reason": {
            "type": "string",
            "description": "Required. A rename with no reason is drift with paperwork."
          }
        }
      }
    },
    "notes": {
      "type": "array",
      "items": {
        "type": "string"
      }
    }
  }
}
