{
  "$schema": "./binding.schema.json",
  "component": "Slider",
  "contract": "../../contracts/components/Slider/Slider.contract.json",
  "framework": "angular",
  "notes": [
    "The track part is reached with a `viewChild` signal query, so the pointer geometry has a box to measure against."
  ]
}
